{
  "schema": "urn:algaguard:schema:onboarding:ble-provisioning-request:v1",
  "schemaVersion": "1.0.0",
  "sessionId": "50000000-0000-4000-8000-000000000001",
  "deviceId": "AG-000001",
  "sessionToken": "sE2vR8yN5kM1pQ7xT4bW9dF6aC3uH0zL",
  "ssid": "AlgaGuard-Lab",
  "password": "simulation-only-password"
}
